### ISSUE TITLE
coredns not working properly when custom ip range is used

### ISSUE THREAD

**Issue by marcozov** [rancher/rke2#4993]
**Environmental Info:**
RKE2 Version: 
```
rke2 version v1.26.10+rke2r1 (9b01c8e4e9f781a2654075f43cb59b922fed1713)
go version go1.20.10 X:boringcrypto
```

Node(s) CPU architecture, OS, and Version: 
```
Linux rke2ins001 5.14.21-150500.55.19-default #1 SMP PREEMPT_DYNAMIC Tue Aug 8 22:15:01 UTC 2023 (9908c29) x86_64 x86_64 x86_64 GNU/Linux
```

Cluster Configuration:
Basic setup, the goal would be to install rancher on top of this cluster.
I tried with 2 and 3 nodes. The problem does not occur with 1 node (it will be clear why in the bug description and reproduction steps).
I installed rke2 with the basic commands:
```
curl -sfL https://get.rke2.io | sh -
systemctl enable rke2-server.service
systemctl start rke2-server.service
```
After defining the config file under `/etc/rancher/rke2/config.yaml`:
```
tls-san:
  - san-1.mydomain
  - san-2.mydomain
  - san-3.mydomain

cluster-cidr: "172.16.0.0/16"
service-cidr: "172.17.0.0/16"
cluster-dns: "172.17.0.10"

token: my-super-token
```
For the second node, I add the `server: https://san-1.mydomain:9345` parameter to the above configuration and I place it to the second node. The name san-1.mydomain resolves to the IP of the first configured node (just like san-2 resolves to the IP of the second configured node, and san-3 will resolve to the IP of the third one).
So, the only customization is for the internal k8s network.

I am following these pages (the information for the basic setup overlap more or less):
 - https://ranchermanager.docs.rancher.com/pages-for-subheaders/install-upgrade-on-a-kubernetes-cluster
 - https://docs.rke2.io/install/ha

**Describe the bug:**
DNS resolution just doesn't work. After some investigation, I noticed that there is a pattern for this issue.
Let's denote the first configured node as N1, and the second configured node as N2.
With 2 nodes, coredns scales up to two pods (one per node) automatically.
If I spawn a pod on N1, then I can only use the coredns pod running on N1 as dns server. Using the coredns pod running on N2 will *not* work.
The same occurs when I spawn a pod on N2.
Since by default it uses 172.17.0.10, which load balances among the pods, it basically never works (although it should roughly half of the times, but in practices it doesn't).

**Steps To Reproduce:**

- deploy two pods, one running on N1 and one running on N2:
```
apiVersion: apps/v1
kind: Deployment
metadata:
  name: interactive-deployment
  namespace: kube-system
spec:
  replicas: 1
  selector:
    matchLabels:
      app: interactive-pod
  template:
    metadata:
      labels:
        app: interactive-pod
    spec:
      nodeName: N1
      containers:
      - image: alpine/curl:latest
        imagePullPolicy: IfNotPresent
        name: interactive-pod
        args: ["/bin/sh", "-c", "sleep 999999"]
      restartPolicy: Always

---
apiVersion: apps/v1
kind: Deployment
metadata:
  name: interactive-deployment-N2
  namespace: kube-system
spec:
  replicas: 1
  selector:
    matchLabels:
      app: interactive-pod-N2
  template:
    metadata:
      labels:
        app: interactive-pod-N2
    spec:
      nodeName: N2
      containers:
      - image: alpine/curl:latest
        imagePullPolicy: IfNotPresent
        name: interactive-pod
        args: ["/bin/sh", "-c", "sleep 999999"]
      restartPolicy: Always
```
 - Take note of the IP address of each coredns pod (excluding the autoscaler)
```
kube-system   interactive-deployment-6cfc8ffb7b-2d56n                 1/1     Running     0          16m   172.16.0.18    N1   <none>           <none>
kube-system   interactive-deployment-rkeins002-66584f6c7b-m9xr8       1/1     Running     0          16m   172.16.1.7     N2   <none>           <none>...
kube-system   rke2-coredns-rke2-coredns-565dfc7d75-9sjpx              1/1     Running     0          29m     172.16.1.2     N2   <none>           <none>
kube-system   rke2-coredns-rke2-coredns-565dfc7d75-r2g2z              1/1     Running     0          36m     172.16.0.9     N1   <none>           <none>
kube-system   rke2-coredns-rke2-coredns-autoscaler-6c48c95bf9-nl8qr   1/1     Running     0          36m     172.16.0.7     N1   <none>           <none>
```
 - Test on the interactive pod running on N1: `kubectl -n kube-system exec -it interactive-deployment-6cfc8ffb7b-2d56n -- sh` --> `nslookup www.google.com  172.16.1.2` fails, while `nslookup www.google.com 172.16.0.9` works.
 - Test on the interactive pod running on N2: `kubectl -n kube-system exec -it interactive-deployment-N2-66584f6c7b-m9xr8 -- sh` --> `nslookup www.google.com 172.16.0.9` fails, while `nslookup www.google.com  172.16.1.2` works.
 - without specifying the dns server (i.e., running only `nslookup www.google.com`) is a bit random. Sometimes it works, sometimes it doesn't.

**Expected behavior:**
I would expect the dns resolution to always work.

**Actual behavior:**
The dns resolution works only if the client pod is on the same node where the coredns pod is running. As result, load balancing coredns on more than 1 nore breaks everything.

**Additional context / logs:**
I enabled some coredns logs and I did some tcpdump.
tcpdump -i any (successful request e.g., pod on N1 sending request to coredns on N1):
```
18:45:16.490672 eth0  Out IP interactive-deployment-6cfc8ffb7b-2d56n.51004 > 172.16.0.9.53: 56235+ A? www.google.com.kube-system.svc.cluster.local. (62)
18:45:16.491070 eth0  In  IP 172.16.0.9.53 > interactive-deployment-6cfc8ffb7b-2d56n.51004: 56235 NXDomain*- 0/1/0 (155)
18:45:16.491419 eth0  Out IP interactive-deployment-6cfc8ffb7b-2d56n.42040 > 172.16.0.9.53: 42061+ A? www.google.com.svc.cluster.local. (50)
18:45:16.491798 eth0  In  IP 172.16.0.9.53 > interactive-deployment-6cfc8ffb7b-2d56n.42040: 42061 NXDomain*- 0/1/0 (143)
18:45:16.492109 eth0  Out IP interactive-deployment-6cfc8ffb7b-2d56n.44010 > 172.16.0.9.53: 27200+ A? www.google.com.cluster.local. (46)
18:45:16.492326 eth0  In  IP 172.16.0.9.53 > interactive-deployment-6cfc8ffb7b-2d56n.44010: 27200 NXDomain*- 0/1/0 (139)
18:45:16.492593 eth0  Out IP interactive-deployment-6cfc8ffb7b-2d56n.46542 > 172.16.0.9.53: 11187+ A? www.google.com.intra.camera.it. (48)
18:45:16.494718 eth0  In  IP 172.16.0.9.53 > interactive-deployment-6cfc8ffb7b-2d56n.46542: 11187 NXDomain* 0/1/0 (144)
18:45:16.494982 eth0  Out IP interactive-deployment-6cfc8ffb7b-2d56n.38438 > 172.16.0.9.53: 60722+ A? www.google.com. (32)
18:45:16.496487 eth0  In  IP 172.16.0.9.53 > interactive-deployment-6cfc8ffb7b-2d56n.38438: 60722 1/4/8 A 216.58.205.36 (502)
18:45:16.496920 eth0  Out IP interactive-deployment-6cfc8ffb7b-2d56n.41749 > 172.16.0.9.53: 28738+ AAAA? www.google.com. (32)
18:45:16.499993 eth0  In  IP 172.16.0.9.53 > interactive-deployment-6cfc8ffb7b-2d56n.41749: 28738 1/4/8 AAAA 2a00:1450:4002:402::2004 (308)
```
tcpdump -i any (failing request e.g., pod on N1 sending request to coredns on N2):
```
18:47:04.145849 eth0  Out IP interactive-deployment-6cfc8ffb7b-2d56n.54288 > 172-16-1-2.rke2-coredns-rke2-coredns.kube-system.svc.cluster.local.53: 17489+ A? www.google.com.kube-system.svc.cluster.local. (62)
18:47:04.240813 eth0  Out IP interactive-deployment-6cfc8ffb7b-2d56n.43979 > 172.17.0.10.53: 22728+ PTR? 2.1.16.172.in-addr.arpa. (41)
18:47:04.241743 eth0  In  IP 172.17.0.10.53 > interactive-deployment-6cfc8ffb7b-2d56n.43979: 22728*- 1/0/0 PTR 172-16-1-2.rke2-coredns-rke2-coredns.kube-system.svc.cluster.local. (144)
18:47:04.344316 eth0  Out IP interactive-deployment-6cfc8ffb7b-2d56n.45738 > 172.17.0.10.53: 22914+ PTR? 10.0.17.172.in-addr.arpa. (42)
18:47:09.148358 eth0  Out IP interactive-deployment-6cfc8ffb7b-2d56n.43073 > 172-16-1-2.rke2-coredns-rke2-coredns.kube-system.svc.cluster.local.53: 17489+ A? www.google.com.kube-system.svc.cluster.local. (62)
18:47:09.347122 eth0  Out IP interactive-deployment-6cfc8ffb7b-2d56n.45738 > 172.17.0.10.53: 22914+ PTR? 10.0.17.172.in-addr.arpa. (42)
18:47:09.396090 eth0  In  ARP, Request who-has interactive-deployment-6cfc8ffb7b-2d56n tell 10-120-132-1.kubernetes.default.svc.cluster.local, length 28
18:47:09.396093 eth0  Out ARP, Request who-has 169.254.1.1 tell interactive-deployment-6cfc8ffb7b-2d56n, length 28
18:47:09.396095 eth0  Out ARP, Reply interactive-deployment-6cfc8ffb7b-2d56n is-at fe:07:0d:e9:fb:37 (oui Unknown), length 28
18:47:09.396119 eth0  In  ARP, Reply 169.254.1.1 is-at ee:ee:ee:ee:ee:ee (oui Unknown), length 28
18:47:14.150379 eth0  Out IP interactive-deployment-6cfc8ffb7b-2d56n.51568 > 172-16-1-2.rke2-coredns-rke2-coredns.kube-system.svc.cluster.local.53: 17489+ A? www.google.com.kube-system.svc.cluster.local. (62)
18:47:14.352612 eth0  Out IP interactive-deployment-6cfc8ffb7b-2d56n.54722 > 172.17.0.10.53: 50378+ PTR? 1.132.120.10.in-addr.arpa. (43)
18:47:14.353156 eth0  In  IP 172.17.0.10.53 > interactive-deployment-6cfc8ffb7b-2d56n.54722: 50378*- 1/0/0 PTR 10-120-132-1.kubernetes.default.svc.cluster.local. (131)
18:47:14.353464 eth0  Out IP interactive-deployment-6cfc8ffb7b-2d56n.42955 > 172.17.0.10.53: 12708+ PTR? 1.1.254.169.in-addr.arpa. (42)
18:47:17.336118 eth0  Out IP6 fe80::fc07:dff:fee9:fb37 > ff02::2: ICMP6, router solicitation, length 16
18:47:19.358850 eth0  Out IP interactive-deployment-6cfc8ffb7b-2d56n.42955 > 172.17.0.10.53: 12708+ PTR? 1.1.254.169.in-addr.arpa. (42)
18:47:24.365118 eth0  Out IP interactive-deployment-6cfc8ffb7b-2d56n.37339 > 172.17.0.10.53: 14330+ PTR? 2.0.0.0.0.0.0.0.0.0.0.0.0.0.0.0.0.0.0.0.0.0.0.0.0.0.0.0.2.0.f.f.ip6.arpa. (90)
18:47:29.368094 eth0  Out IP interactive-deployment-6cfc8ffb7b-2d56n.37339 > 172.17.0.10.53: 14330+ PTR? 2.0.0.0.0.0.0.0.0.0.0.0.0.0.0.0.0.0.0.0.0.0.0.0.0.0.0.0.2.0.f.f.ip6.arpa. (90)
18:47:34.372315 eth0  Out IP interactive-deployment-6cfc8ffb7b-2d56n.32774 > 172.17.0.10.53: 6455+ PTR? 7.3.b.f.9.e.e.f.f.f.d.0.7.0.c.f.0.0.0.0.0.0.0.0.0.0.0.0.0.8.e.f.ip6.arpa. (90)
18:47:34.379338 eth0  In  IP 172.17.0.10.53 > interactive-deployment-6cfc8ffb7b-2d56n.32774: 6455 NXDomain 0/1/0 (153)
18:47:39.604051 eth0  Out ARP, Request who-has 169.254.1.1 tell interactive-deployment-6cfc8ffb7b-2d56n, length 28
18:47:39.604081 eth0  In  ARP, Reply 169.254.1.1 is-at ee:ee:ee:ee:ee:ee (oui Unknown), length 28
18:47:39.604084 eth0  In  ARP, Request who-has interactive-deployment-6cfc8ffb7b-2d56n tell 10-120-132-1.kubernetes.default.svc.cluster.local, length 28
18:47:39.604096 eth0  Out ARP, Reply interactive-deployment-6cfc8ffb7b-2d56n is-at fe:07:0d:e9:fb:37 (oui Unknown), length 28
```

On the coredns side, I can see the following on the coredns pod when the request works:
```
kubectl logs -f -n kube-system rke2-coredns-rke2-coredns-565dfc7d75-r2g2z
.:53
[INFO] plugin/reload: Running configuration SHA512 = c18591e7950724fe7f26bd172b7e98b6d72581b4a8fc4e5fc4cfd08229eea58f4ad043c9fd3dbd1110a11499c4aa3164cdd63ca0dd5ee59651d61756c4f671b7
CoreDNS-1.10.1
linux/amd64, go1.20.4 X:boringcrypto, 055b2c31
[INFO] Reloading
[INFO] plugin/reload: Running configuration SHA512 = 173bdac100d46bd28e72a0f5b162364e853082273460a2cde26aec1824a375cfe4c09bc70846776a107b743a8b9f60c21aa15f4cdbdf8ff92e10aef5031517d7
[INFO] Reloading complete
[INFO] 127.0.0.1:58286 - 12126 "HINFO IN 4974319674603208918.6268568715315969069. udp 57 false 512" NXDOMAIN qr,rd,ra 132 0.03489731s
[INFO] 172.16.0.18:42647 - 64395 "A IN www.google.com.kube-system.svc.cluster.local. udp 62 false 512" NXDOMAIN qr,aa,rd 155 0.000223443s
[INFO] 172.16.0.18:33673 - 43737 "A IN www.google.com.svc.cluster.local. udp 50 false 512" NXDOMAIN qr,aa,rd 143 0.000285355s
[INFO] 172.16.0.18:50296 - 7457 "A IN www.google.com.cluster.local. udp 46 false 512" NXDOMAIN qr,aa,rd 139 0.000098638s
[INFO] 172.16.0.18:58203 - 50028 "A IN www.google.com.intra.camera.it. udp 48 false 512" NXDOMAIN qr,aa,rd,ra 144 0.001900923s
[INFO] 172.16.0.18:36766 - 41665 "A IN www.google.com. udp 32 false 512" NOERROR qr,rd,ra 502 0.00212509s
[INFO] 172.16.0.18:52835 - 62258 "AAAA IN www.google.com. udp 32 false 512" NOERROR qr,rd,ra 514 0.000904699s
```

Otherwise, I can't see anything. So, it's like if the coredns pod on the other node does not receive it.

**Comment by brandond** [comment]
> The dns resolution works only if the client pod is on the same node where the coredns pod is running. As result, load balancing coredns on more than 1 nore breaks everything.

This indicates that CNI traffic between cluster members is being dropped. Please confirm that you've opened the correct ports for inter-node CNI traffic, and don't have any other firewall rules in place that would block traffic to either of the cluster address ranges.

**Comment by marcozov** [comment]
Thanks for your reply. If I run some tcpdump on the node, I can see traffic (any traffic, not only dns) flowing out on the flannel.1 interface, but I can't see it on the other node. I guess some communication is broken (although they are on the same lan and the suse firewall is disabled...).

I see traffic like this being lost:
```
N1:~ # tcpdump -i flannel.1
tcpdump: verbose output suppressed, use -v[v]... for full protocol decode
listening on flannel.1, link-type EN10MB (Ethernet), snapshot length 262144 bytes
11:28:33.122552 IP 172.16.0.23.56826 > 172.16.1.10.https: Flags [S], seq 1616041425, win 64860, options [mss 1410,sackOK,TS val 3184526753 ecr 0,nop,wscale 7], length 0
11:28:34.144080 IP 172.16.0.23.56826 > 172.16.1.10.https: Flags [S], seq 1616041425, win 64860, options [mss 1410,sackOK,TS val 3184527774 ecr 0,nop,wscale 7], length 0
```
But I don't see anything on the flannel.1 interface of the other node, so I guess there is some connectivity issue.
If I run tcpdump on the physical interface I see the traffic between the 2 nodes:
```
tcpdump -i eth0 host 10.120.132.2
tcpdump: verbose output suppressed, use -v[v]... for full protocol decode
listening on eth0, link-type EN10MB (Ethernet), snapshot length 262144 bytes
11:45:52.837759 IP N1.etcd-server > N2.47704: Flags [P.], seq 1681656803:1681656903, ack 823284690, win 501, options [nop,nop,TS val 1966167282 ecr 991586325], length 100
11:45:52.838068 IP N2.47704 > N1.etcd-server: Flags [.], ack 100, win 1286, options [nop,nop,TS val 991586447 ecr 1966167282], length 0
11:45:52.838330 IP N2.etcd-server > N1.47138: Flags [P.], seq 3396462945:3396463039, ack 2913342897, win 501, options [nop,nop,TS val 991586447 ecr 1966167160], length 94
11:45:52.838367 IP N1.47138 > N2.etcd-server: Flags [.], ack 94, win 3082, options [nop,nop,TS val 1966167283 ecr 991586447], length 0
...
11:45:53.248387 IP N2.35326 > N1.otv: OTV, flags [I] (0x08), overlay 0, instance 1
IP 172.16.1.0.42056 > 172.16.0.25.10250: Flags [S], seq 4049925802, win 64860, options [mss 1410,sackOK,TS val 3332477633 ecr 0,nop,wscale 7], length 0
11:45:53.249623 IP N2.47214 > N1.otv: OTV, flags [I] (0x08), overlay 0, instance 1
IP 172.16.1.0.42062 > 172.16.0.25.10250: Flags [S], seq 3180564245, win 64860, options [mss 1410,sackOK,TS val 3332477634 ecr 0,nop,wscale 7], length 0
11:45:53.250848 IP N2.60440 > N1.otv: OTV, flags [I] (0x08), overlay 0, instance 1
```
so there is some communication between the nodes. Is there any way to isolate the traffic I'm interested in (i.e., the https traffic flowing through the flannel.1 interface) on the physical interface?

**Comment by brandond** [comment]
Are these running on vmware by any chance? There are some long-running issues with checksum offload being broken on that platform, see https://github.com/projectcalico/calico/issues/3145#issuecomment-578517597

**Comment by marcozov** [comment]
Apparently `ethtool --offload flannel.1 rx off tx off` fixed the issue.
I noticed that I had the same issue with the default network as well (10.42.0.0/16 and 10.43.0.0/16), so it's not specific to the cluster-cidr config.
Anyway, it works with both network configurations.
Just wondering: what's the problem with disabling those checks with `ethtool --offload flannel.1 rx off tx off`?

Thanks!

**Comment by brandond** [comment]
I'm not sure what you mean by `what's the problem with disabling those checks`. You're disabling hardware offload functionality, which means that all the things that could be done with hardware acceleration (checksums, segmentation/reassembly, and so on) are now done by the kernel. This is theoretically slower and puts more load on the CPU.
