### ISSUE TITLE
Strange source IP addresses

### ISSUE THREAD

**Issue by xhejtman** [rancher/rke2#1227]
Hello,

we have rke2 version 1.20.7 with pretty much standard configuration and CIS-1.5 profile applied. We wanted to use network policy and discovered, that for some strange reason, source IPs of pods are mangled to x.y.z.0 address. E.g., rke2-flannel-host-networking policy contains:
    - ipBlock:
        cidr: 10.42.0.0/32
    - ipBlock:
        cidr: 10.42.1.0/32
    - ipBlock:
        cidr: 10.42.12.0/32
    - ipBlock:
        cidr: 10.42.16.0/32
    - ipBlock:
        cidr: 10.42.17.0/32
    - ipBlock:
        cidr: 10.42.2.0/32
    - ipBlock:
        cidr: 10.42.20.0/32
    - ipBlock:
        cidr: 10.42.21.0/32
    - ipBlock:
        cidr: 10.42.22.0/32
    - ipBlock:
        cidr: 10.42.23.0/32
    - ipBlock:
        cidr: 10.42.7.0/32

If we create network security policy that references a namespace, it creates ipset, e.g.:
10.42.16.2
10.42.12.103
10.42.20.188
10.42.16.254
10.42.20.105
10.42.22.123
10.42.7.141
10.42.17.254
10.42.2.11
10.42.21.251
10.42.12.101
10.42.7.139
10.42.17.250
10.42.12.99

however, if addresses are mangled to x.y.z.0, they never match the set.

Is it wrong configuration or a bug? Thanks.

**Comment by brandond** [comment]
This is policy is required to allow traffic from pods running with HostNetwork to pods on other nodes. You can read through the issue history at https://github.com/rancher/rke2/issues/745#issuecomment-790149691 for more information.

**Comment by xhejtman** [comment]
No, the flannel policy is ok. My complain is about collected IPs. If it is ok that it contains IPs with last part zeroed (.0/32), than custom network policy like this:

`apiVersion: networking.k8s.io/v1`
`kind: NetworkPolicy`
`metadata:`
`  name: fidentis-network-policy`
`  namespace: fidentis-ns`
`spec:`
`  podSelector:`
`    matchLabels:`
`      app: fidentis`
`  policyTypes:`
`  - Ingress`
`  ingress:`
`  - from:`
`    - namespaceSelector:`
`        matchLabels:`
`          kubernetes.io/metadata.name: kube-system`
`    ports:`
`    - protocol: TCP`
`      port: 8080`

does not work, as it creates rules containing real addresses like .141 but while it sends addreses .0, it never matches the set and the policy does not work.

**Comment by brandond** [comment]
When you say `it creates rules containing real addresses like .141` I believe you're referring to the rules generated by calico? That isn't handled by RKE2; the only involvement we have in all this is to create the default network policies that allow hostnetwork traffic for the system namespaces.

**Comment by xhejtman** [comment]
Ok, let me better explain it. The policy from the comment #issuecomment-871583792 creates an ipset:
10.42.16.2 10.42.12.103 10.42.20.188 10.42.16.254 10.42.20.105 10.42.22.123 10.42.7.141 10.42.17.254 10.42.2.11 10.42.21.251 10.42.12.101 10.42.7.139 10.42.17.250 10.42.12.99

however, using tcpdump on target pod's interface, I can see that src addresses are always zeroed in C net, i.e., src address is e.g., 10.42.7.0 or 10.42.22.0. So the src address never matches the created ipset.

Not sure, if it is RKE2 related, or k8s related in general.

**Comment by brandond** [comment]
The link you pasted didn't work, so I'm not sure which policy you're referring to. The source address NATing that you're noticing is just how flannel handles traffic within the cluster overlay network. As far as I'm aware this is all working as designed - the policy is supposed to allow traffic from HostNetwork pods (like the apiserver) to pods running on other nodes. It is not intended to allow anything else.

**Comment by xhejtman** [comment]
this policy
apiVersion: networking.k8s.io/v1
kind: NetworkPolicy
metadata:
name: fidentis-network-policy
namespace: fidentis-ns
spec:
podSelector:
matchLabels:
app: fidentis
policyTypes:
- Ingress
ingress:
- from:
- namespaceSelector:
matchLabels:
kubernetes.io/metadata.name: kube-system
ports:
- protocol: TCP
port: 8080

creates iptables ipset with ips:
10.42.16.2 10.42.12.103 10.42.20.188 10.42.16.254 10.42.20.105 10.42.22.123 10.42.7.141 10.42.17.254 10.42.2.11 10.42.21.251 10.42.12.101 10.42.7.139 10.42.17.250 10.42.12.99

using tcpdump on calico interface before the policy is applied, I can see packets like:
17:30:20.639312 IP 10.42.22.0.41282 > 10.42.12.241.8080: Flags [.], ack 241, win 506, options [nop,nop,TS val 730502507 ecr 943870659], length 0
17:30:20.639381 IP 10.42.22.0.41282 > 10.42.12.241.8080: Flags [.], ack 1512, win 497, options [nop,nop,TS val 730502507 ecr 943870660], length 0
17:30:21.121419 IP 10.42.7.0.43432 > 10.42.12.241.8080: Flags [S], seq 2153493983, win 64896, options [mss 1352,sackOK,TS val 6018359 ecr 0,nop,wscale 7], length 0
17:30:21.121478 IP 10.42.12.241.8080 > 10.42.7.0.43432: Flags [S.], seq 69190891, ack 2153493984, win 64704, options [mss 1360,sackOK,TS val 1265452729 ecr 6018359,nop,wscale 7], length 0
17:30:21.123109 IP 10.42.7.0.43432 > 10.42.12.241.8080: Flags [.], ack 1, win 507, options [nop,nop,TS val 6018362 ecr 1265452729], length 0
17:30:21.123214 IP 10.42.7.0.43432 > 10.42.12.241.8080: Flags [P.], seq 1:340, ack 1, win 507, options [nop,nop,TS val 6018362 ecr 1265452729], length 339: HTTP: GET /README.txt HTTP/1.1
17:30:21.123229 IP 10.42.12.241.8080 > 10.42.7.0.43432: Flags [.], ack 340, win 503, options [nop,nop,TS val 1265452731 ecr 6018362], length 0
17:30:21.124470 IP 10.42.12.241.8080 > 10.42.7.0.43432: Flags [P.], seq 1:241, ack 340, win 503, options [nop,nop,TS val 1265452732 ecr 6018362], length 240: HTTP: HTTP/1.1 200 OK
17:30:21.124701 IP 10.42.12.241.8080 > 10.42.7.0.43432: Flags [P.], seq 241:1512, ack 340, win 503, options [nop,nop,TS val 1265452733 ecr 6018362], length 1271: HTTP
17:30:21.125171 IP 10.42.7.0.43432 > 10.42.12.241.8080: Flags [.], ack 241, win 506, options [nop,nop,TS val 6018364 ecr 1265452732], length 0
17:30:21.125207 IP 10.42.7.0.43432 > 10.42.12.241.8080: Flags [.], ack 1512, win 497, options [nop,nop,TS val 6018364 ecr 1265452733], length 0


after I apply the policy, literally nothing is allowed to communicate with the pod with ip 10.42.12.241 because source ips: 10.42.7.0 or 10.42.22.0 clearly do not match any ip in the mentioned ipset.

**Comment by brandond** [comment]
The manifest you pasted in was almost impossible to read since you stripped out all the indentation; if you're going to provide examples can you use \`\`\`yaml markup around it? I've cleaned it up a bit so I can see what you're trying to do.

The policy you've written appears to only allow ingress to the `app: fidentis` pods on port 8080 from pods in the kube-system namespace; all other traffic will be blocked. Is this your intent? As noted in the issue I linked to, pods using HostNetwork require an additional policy that matches CidrBlocks unique to each node; this is a limitation of Kubernetes network policies as discussed here: https://github.com/rancher/rke2/issues/745#issuecomment-790149691

**Comment by xhejtman** [comment]
Yes, the intention is to allow ingress to app: fidentis to port 8080. As you are saying this is not enough for ingress pods that use host network and that's the reason why this policy does not work. And to get it work I need to apply that rke2-flannel-host-networking policy to allow access from host-networked pods? 

As I understand from the link you posted, the rke2-flannel-host-networking is managed by controler and changes according to actual cluster situation. 

So how can I say that nginx ingress pods and only those are allowed to connect to app: fidentis? The nginx ingress pods are host networked pods.

I want this as ingress rules contain basic auth rules which can be avoided if you connect from inside cluster to the service directly (not using ingress). Perhaps there is an easier way?

**Comment by brandond** [comment]
> Yes, the intention is to allow ingress to app: fidentis to port 8080. As you are saying this is not enough for ingress pods that use host network and that's the reason why this policy does not work.

Correct

> And to get it work I need to apply that rke2-flannel-host-networking policy to allow access from host-networked pods?

There's not really any way for you to 'apply' that policy to an additional namespace yourself, since it is managed internally and only applied to the kube-system, default, and public namespaces.

> So how can I say that nginx ingress pods and only those are allowed to connect to app: fidentis? The nginx ingress pods are host networked pods.

Your best bet would probably be to switch from deploying the ingress as as Deployment with host network pods, to a more traditional Ingress Service with the ingress pods using the cluster network.

**Comment by xhejtman** [comment]
I guess the namespace already has applied host-networking policy as the access works if I do not apply my restrictive network policy. Or am I wrong here?

The goal can be also seen to deny access from all other namespaces to this pod except kube-system including host-networked pods.

**Comment by brandond** [comment]
I think you're going to have a hard time doing anything with host network pods, given the limitations of current network policy implementations.

**Comment by xhejtman** [comment]
ok, thanks, I try to figure out something.
