### ISSUE TITLE
Pod-to-pod communication within node is broken

### ISSUE THREAD

**Issue by cwayne18** [rancher/rke2#2388]
Issue description:
Pod to pod communication is broken within the node

Environment information:

Single Node RKE2 Cluster
Node OS: RHEL 8.5
RKE2: v1.21.4+rke2r1
Kubernetes version: v1.21.4+rke2r1
CNI: Canal

Business impact:
Customer can't proceed with their product deployment on customer site

Troubleshooting steps:

no firewalld
selinux permissive
 

Verified below* Ping from node to pod IPs working fine
* ip_forward is set to 1.
* arp_filter is set to 0.
* iptables -L -v -n not showing rule with an increasing counter on any of the DROP rules.
* tcpdump on the cali interface of the source pod shows that the packet is leaving the interface.
* tcpdump on the destination pod's cali interface is not showing any packets.
 
The output of tcpdump on source Pod's cali interface.
```console
$ tcpdump -nnn -i calic865132bbab
dropped privs to tcpdump
tcpdump: verbose output suppressed, use -v or -vv for full protocol decode
listening on calic865132bbab, link-type EN10MB (Ethernet), capture size 262144 bytes
12:27:56.124834 ARP, Request who-has 169.254.1.1 tell 10.42.0.17, length 28
12:27:56.124867 ARP, Reply 169.254.1.1 is-at ee:ee:ee:ee:ee:ee, length 28
12:27:56.124871 IP 10.42.0.17 > 10.42.0.16: ICMP echo request, id 27, seq 1, length 64
```
**
no firewalld
selinux permissive
Verified below* Ping from node to pod IPs working fine
* ip_forward is set to 1.
* arp_filter is set to 0.
* iptables -L -v -n not showing rule with increasing counter on any of the DROP rules.
* tcpdump on the cali interface of the source pod shows that the packet is leaving the interface.
* tcpdump on the destination pod's cali interface is not showing any packets.
Verified that the known network issues documented in rke2 docs are covered 
https://docs.rke2.io/known_issues/#networkmanager
 
Output of tcpdump on source Pod's cali interface.
 
```console
$ tcpdump -nnn -i calic865132bbab
dropped privs to tcpdump
tcpdump: verbose output suppressed, use -v or -vv for full protocol decode
listening on calic865132bbab, link-type EN10MB (Ethernet), capture size 262144 bytes
12:27:56.124834 ARP, Request who-has 169.254.1.1 tell 10.42.0.17, length 28
12:27:56.124867 ARP, Reply 169.254.1.1 is-at ee:ee:ee:ee:ee:ee, length 28
12:27:56.124871 IP 10.42.0.17 > 10.42.0.16: ICMP echo request, id 27, seq 1, length 64
```
**No reply we could see in tcpdump
Repro steps:

NA
Workaround:
Is workaround available and implemented? No

Actual behavior:
Pod-to-pod communication should work

Expected behavior:
pod-to-Pod communication is not working

**Comment by cwayne18** [comment]
This turns out to have been a firewall issue in the environment
