### ISSUE TITLE
Pod Connectivity Issue on Oracle Linux 9 with Calico (rke2 custom cluster)

### ISSUE THREAD

**Issue by panstou** [rancher/rke2#7932]
**Description:**
I deployed an RKE2 custom downstream cluster using Rancher Manager and tested multiple network configurations:

- Canal (Flannel + Calico) → Not working on Oracle Linux 9
- Calico-only → Not working on Oracle Linux 9
- Flannel-only → Working on Oracle Linux 9
- Same configurations on Oracle Linux 8 → All working

On Oracle Linux 9, when using Canal (Flannel + Calico) or Calico-only, pods on different nodes cannot communicate. However, with Flannel-only, inter-node pod communication works fine. The same configurations work correctly on Oracle Linux 8.

**Steps to Reproduce:**

1. Deploy an RKE2 custom downstream cluster via Rancher Manager.
2. Configure networking with:
   - Canal (Flannel + Calico)
   - Calico-only
   - Flannel-only

3. Deploy test pods across multiple nodes.
4. Attempt pod-to-pod communication across nodes.

**Expected Behavior:**

Pods on different nodes should be able to communicate with each other in all configurations.

**Actual Behavior:**

- Canal (Flannel + Calico) and Calico-only on OL9: Pods cannot communicate across nodes.
- Flannel-only on OL9: Pods communicate successfully across nodes.
- All configurations on OL8: Everything works fine.

**Environment:**

- Operating System:
      Not Working: Oracle Linux Server 9.4, Kernel Version: 5.15.0-300.163.18.el9uek.x86_64
      Working: Oracle Linux Server 8.9, Kernel Version: 5.4.17-2136.327.2.el8uek.x86_64
- Rancher Manager Version: 2.10.1
- RKE2 Version:  rke2 version v1.30.8+rke2r1 (3e6fb8634f164d623f53f7b61d07b27726565d4e)
- Rke2-calico Version:  rke2-calico-v3.29.100

**Additional Notes:**
- firewalld and SELinux disabled
- NetworkManager is configured to ignore calico/flannel related network interfaces
- Flannel-only works fine, so the issue might be Calico-specific.

**Comment by panstou** [comment]
Hello,

I am running the overlaytest of rancher manager:
https://ranchermanager.docs.rancher.com/troubleshooting/other-troubleshooting-tips/networking

I ping another pod on a different node and occasionally get a response, usually not:
```
root@overlaytest-4qvfq:~# ping 10.171.33.2
PING 10.171.33.2 (10.171.33.2) 56(84) bytes of data.
64 bytes from 10.171.33.2: icmp_seq=11 ttl=62 time=2045 ms
64 bytes from 10.171.33.2: icmp_seq=12 ttl=62 time=1021 ms
64 bytes from 10.171.33.2: icmp_seq=13 ttl=62 time=0.291 ms
64 bytes from 10.171.33.2: icmp_seq=14 ttl=62 time=0.516 ms
64 bytes from 10.171.33.2: icmp_seq=15 ttl=62 time=0.419 ms
64 bytes from 10.171.33.2: icmp_seq=16 ttl=62 time=0.491 ms
64 bytes from 10.171.33.2: icmp_seq=17 ttl=62 time=0.407 ms
64 bytes from 10.171.33.2: icmp_seq=18 ttl=62 time=0.443 ms
64 bytes from 10.171.33.2: icmp_seq=19 ttl=62 time=0.426 ms
64 bytes from 10.171.33.2: icmp_seq=20 ttl=62 time=0.504 ms


--- 10.171.33.2 ping statistics ---
28 packets transmitted, 10 received, 64% packet loss, time 27652ms
rtt min/avg/max/mdev = 0.291/307.064/2045.570/654.606 ms, pipe 2
```

tcpdump on the node:
```
# tcpdump -vv -eni vxlan.calico host 10.171.33.2
dropped privs to tcpdump
tcpdump: listening on vxlan.calico, link-type EN10MB (Ethernet), snapshot length 262144 bytes
22:07:56.566886 66:5d:3e:73:0c:6d > 66:37:95:22:c7:66, ethertype IPv4 (0x0800), length 98: (tos 0x0, ttl 63, id 1575, offset 0, flags [DF], proto ICMP (1), length 84)
    10.171.160.77 > 10.171.33.2: ICMP echo request, id 65, seq 5, length 64
22:07:57.590826 66:5d:3e:73:0c:6d > 66:37:95:22:c7:66, ethertype IPv4 (0x0800), length 98: (tos 0x0, ttl 63, id 2048, offset 0, flags [DF], proto ICMP (1), length 84)
    10.171.160.77 > 10.171.33.2: ICMP echo request, id 65, seq 6, length 64
22:07:58.614858 66:5d:3e:73:0c:6d > 66:37:95:22:c7:66, ethertype IPv4 (0x0800), length 98: (tos 0x0, ttl 63, id 2304, offset 0, flags [DF], proto ICMP (1), length 84)
    10.171.160.77 > 10.171.33.2: ICMP echo request, id 65, seq 7, length 64
22:07:59.638795 66:5d:3e:73:0c:6d > 66:37:95:22:c7:66, ethertype IPv4 (0x0800), length 98: (tos 0x0, ttl 63, id 2442, offset 0, flags [DF], proto ICMP (1), length 84)
    10.171.160.77 > 10.171.33.2: ICMP echo request, id 65, seq 8, length 64
22:08:00.662831 66:5d:3e:73:0c:6d > 66:37:95:22:c7:66, ethertype IPv4 (0x0800), length 98: (tos 0x0, ttl 63, id 2673, offset 0, flags [DF], proto ICMP (1), length 84)
    10.171.160.77 > 10.171.33.2: ICMP echo request, id 65, seq 9, length 64
22:08:01.686853 66:5d:3e:73:0c:6d > 66:37:95:22:c7:66, ethertype IPv4 (0x0800), length 98: (tos 0x0, ttl 63, id 3408, offset 0, flags [DF], proto ICMP (1), length 84)
    10.171.160.77 > 10.171.33.2: ICMP echo request, id 65, seq 10, length 64
22:08:02.710848 66:5d:3e:73:0c:6d > 66:37:95:22:c7:66, ethertype IPv4 (0x0800), length 98: (tos 0x0, ttl 63, id 4268, offset 0, flags [DF], proto ICMP (1), length 84)
    10.171.160.77 > 10.171.33.2: ICMP echo request, id 65, seq 11, length 64
22:08:03.734818 66:5d:3e:73:0c:6d > 66:37:95:22:c7:66, ethertype IPv4 (0x0800), length 98: (tos 0x0, ttl 63, id 5019, offset 0, flags [DF], proto ICMP (1), length 84)
    10.171.160.77 > 10.171.33.2: ICMP echo request, id 65, seq 12, length 64
22:08:04.754163 66:37:95:22:c7:66 > 66:5d:3e:73:0c:6d, ethertype IPv4 (0x0800), length 98: (tos 0x0, ttl 63, id 48666, offset 0, flags [none], proto ICMP (1), length 84)
    10.171.33.2 > 10.171.160.77: ICMP echo reply, id 65, seq 11, length 64
22:08:04.754207 66:37:95:22:c7:66 > 66:5d:3e:73:0c:6d, ethertype IPv4 (0x0800), length 98: (tos 0x0, ttl 63, id 48667, offset 0, flags [none], proto ICMP (1), length 84)
    10.171.33.2 > 10.171.160.77: ICMP echo reply, id 65, seq 12, length 64
22:08:04.756516 66:5d:3e:73:0c:6d > 66:37:95:22:c7:66, ethertype IPv4 (0x0800), length 98: (tos 0x0, ttl 63, id 5282, offset 0, flags [DF], proto ICMP (1), length 84)
    10.171.160.77 > 10.171.33.2: ICMP echo request, id 65, seq 13, length 64
22:08:04.756602 66:37:95:22:c7:66 > 66:5d:3e:73:0c:6d, ethertype IPv4 (0x0800), length 98: (tos 0x0, ttl 63, id 48669, offset 0, flags [none], proto ICMP (1), length 84)
    10.171.33.2 > 10.171.160.77: ICMP echo reply, id 65, seq 13, length 64
22:08:05.782856 66:5d:3e:73:0c:6d > 66:37:95:22:c7:66, ethertype IPv4 (0x0800), length 98: (tos 0x0, ttl 63, id 5507, offset 0, flags [DF], proto ICMP (1), length 84)
    10.171.160.77 > 10.171.33.2: ICMP echo request, id 65, seq 14, length 64
22:08:05.783005 66:37:95:22:c7:66 > 66:5d:3e:73:0c:6d, ethertype IPv4 (0x0800), length 98: (tos 0x0, ttl 63, id 49161, offset 0, flags [none], proto ICMP (1), length 84)
    10.171.33.2 > 10.171.160.77: ICMP echo reply, id 65, seq 14, length 64
22:08:06.806813 66:5d:3e:73:0c:6d > 66:37:95:22:c7:66, ethertype IPv4 (0x0800), length 98: (tos 0x0, ttl 63, id 6098, offset 0, flags [DF], proto ICMP (1), length 84)
    10.171.160.77 > 10.171.33.2: ICMP echo request, id 65, seq 15, length 64
22:08:06.806940 66:37:95:22:c7:66 > 66:5d:3e:73:0c:6d, ethertype IPv4 (0x0800), length 98: (tos 0x0, ttl 63, id 49472, offset 0, flags [none], proto ICMP (1), length 84)
    10.171.33.2 > 10.171.160.77: ICMP echo reply, id 65, seq 15, length 64
22:08:07.830851 66:5d:3e:73:0c:6d > 66:37:95:22:c7:66, ethertype IPv4 (0x0800), length 98: (tos 0x0, ttl 63, id 6730, offset 0, flags [DF], proto ICMP (1), length 84)
    10.171.160.77 > 10.171.33.2: ICMP echo request, id 65, seq 16, length 64
22:08:07.830973 66:37:95:22:c7:66 > 66:5d:3e:73:0c:6d, ethertype IPv4 (0x0800), length 98: (tos 0x0, ttl 63, id 49994, offset 0, flags [none], proto ICMP (1), length 84)
    10.171.33.2 > 10.171.160.77: ICMP echo reply, id 65, seq 16, length 64
22:08:08.854800 66:5d:3e:73:0c:6d > 66:37:95:22:c7:66, ethertype IPv4 (0x0800), length 98: (tos 0x0, ttl 63, id 6808, offset 0, flags [DF], proto ICMP (1), length 84)
    10.171.160.77 > 10.171.33.2: ICMP echo request, id 65, seq 17, length 64
22:08:08.854897 66:37:95:22:c7:66 > 66:5d:3e:73:0c:6d, ethertype IPv4 (0x0800), length 98: (tos 0x0, ttl 63, id 50615, offset 0, flags [none], proto ICMP (1), length 84)
    10.171.33.2 > 10.171.160.77: ICMP echo reply, id 65, seq 17, length 64
22:08:09.878883 66:5d:3e:73:0c:6d > 66:37:95:22:c7:66, ethertype IPv4 (0x0800), length 98: (tos 0x0, ttl 63, id 7221, offset 0, flags [DF], proto ICMP (1), length 84)
    10.171.160.77 > 10.171.33.2: ICMP echo request, id 65, seq 18, length 64
22:08:09.879001 66:37:95:22:c7:66 > 66:5d:3e:73:0c:6d, ethertype IPv4 (0x0800), length 98: (tos 0x0, ttl 63, id 50778, offset 0, flags [none], proto ICMP (1), length 84)
    10.171.33.2 > 10.171.160.77: ICMP echo reply, id 65, seq 18, length 64
22:08:10.902803 66:5d:3e:73:0c:6d > 66:37:95:22:c7:66, ethertype IPv4 (0x0800), length 98: (tos 0x0, ttl 63, id 8220, offset 0, flags [DF], proto ICMP (1), length 84)
    10.171.160.77 > 10.171.33.2: ICMP echo request, id 65, seq 19, length 64
22:08:10.902912 66:37:95:22:c7:66 > 66:5d:3e:73:0c:6d, ethertype IPv4 (0x0800), length 98: (tos 0x0, ttl 63, id 51779, offset 0, flags [none], proto ICMP (1), length 84)
    10.171.33.2 > 10.171.160.77: ICMP echo reply, id 65, seq 19, length 64
22:08:11.926898 66:5d:3e:73:0c:6d > 66:37:95:22:c7:66, ethertype IPv4 (0x0800), length 98: (tos 0x0, ttl 63, id 8474, offset 0, flags [DF], proto ICMP (1), length 84)
    10.171.160.77 > 10.171.33.2: ICMP echo request, id 65, seq 20, length 64
22:08:11.927024 66:37:95:22:c7:66 > 66:5d:3e:73:0c:6d, ethertype IPv4 (0x0800), length 98: (tos 0x0, ttl 63, id 52218, offset 0, flags [none], proto ICMP (1), length 84)
    10.171.33.2 > 10.171.160.77: ICMP echo reply, id 65, seq 20, length 64
22:08:12.951804 66:5d:3e:73:0c:6d > 66:37:95:22:c7:66, ethertype IPv4 (0x0800), length 98: (tos 0x0, ttl 63, id 9460, offset 0, flags [DF], proto ICMP (1), length 84)
    10.171.160.77 > 10.171.33.2: ICMP echo request, id 65, seq 21, length 64
22:08:13.974783 66:5d:3e:73:0c:6d > 66:37:95:22:c7:66, ethertype IPv4 (0x0800), length 98: (tos 0x0, ttl 63, id 9938, offset 0, flags [DF], proto ICMP (1), length 84)
    10.171.160.77 > 10.171.33.2: ICMP echo request, id 65, seq 22, length 64
22:08:14.998849 66:5d:3e:73:0c:6d > 66:37:95:22:c7:66, ethertype IPv4 (0x0800), length 98: (tos 0x0, ttl 63, id 10073, offset 0, flags [DF], proto ICMP (1), length 84)
    10.171.160.77 > 10.171.33.2: ICMP echo request, id 65, seq 23, length 64
22:08:16.022863 66:5d:3e:73:0c:6d > 66:37:95:22:c7:66, ethertype IPv4 (0x0800), length 98: (tos 0x0, ttl 63, id 10648, offset 0, flags [DF], proto ICMP (1), length 84)
    10.171.160.77 > 10.171.33.2: ICMP echo request, id 65, seq 24, length 64
22:08:17.046800 66:5d:3e:73:0c:6d > 66:37:95:22:c7:66, ethertype IPv4 (0x0800), length 98: (tos 0x0, ttl 63, id 10655, offset 0, flags [DF], proto ICMP (1), length 84)
    10.171.160.77 > 10.171.33.2: ICMP echo request, id 65, seq 25, length 64
22:08:18.070804 66:5d:3e:73:0c:6d > 66:37:95:22:c7:66, ethertype IPv4 (0x0800), length 98: (tos 0x0, ttl 63, id 11038, offset 0, flags [DF], proto ICMP (1), length 84)
    10.171.160.77 > 10.171.33.2: ICMP echo request, id 65, seq 26, length 64
22:08:19.094862 66:5d:3e:73:0c:6d > 66:37:95:22:c7:66, ethertype IPv4 (0x0800), length 98: (tos 0x0, ttl 63, id 11820, offset 0, flags [DF], proto ICMP (1), length 84)
    10.171.160.77 > 10.171.33.2: ICMP echo request, id 65, seq 27, length 64
22:08:20.118835 66:5d:3e:73:0c:6d > 66:37:95:22:c7:66, ethertype IPv4 (0x0800), length 98: (tos 0x0, ttl 63, id 12149, offset 0, flags [DF], proto ICMP (1), length 84)
    10.171.160.77 > 10.171.33.2: ICMP echo request, id 65, seq 28, length 64
```

tcpdump on the pod:
```
root@overlaytest-hwkqv:~# tcpdump -vvv
tcpdump: listening on eth0, link-type EN10MB (Ethernet), capture size 262144 bytes
21:07:59.634066 ARP, Ethernet (len 6), IPv4 (len 4), Request who-has overlaytest-hwkqv tell ocvlt-kub386.test.oami.eu, length 28
21:07:59.634794 IP (tos 0x0, ttl 64, id 32336, offset 0, flags [DF], proto UDP (17), length 72)
    overlaytest-hwkqv.53209 > rke2-coredns-rke2-coredns.kube-system.svc.cluster.local.domain: [bad udp cksum 0x36a8 -> 0x498b!] 26729+ PTR? 71.106.136.10.in-addr.arpa. (44)
21:08:00.658011 ARP, Ethernet (len 6), IPv4 (len 4), Request who-has overlaytest-hwkqv tell ocvlt-kub386.test.oami.eu, length 28
21:08:01.686923 ARP, Ethernet (len 6), IPv4 (len 4), Request who-has overlaytest-hwkqv tell ocvlt-kub386.test.oami.eu, length 28
21:08:02.706998 ARP, Ethernet (len 6), IPv4 (len 4), Request who-has overlaytest-hwkqv tell ocvlt-kub386.test.oami.eu, length 28
21:08:03.730099 ARP, Ethernet (len 6), IPv4 (len 4), Request who-has overlaytest-hwkqv tell ocvlt-kub386.test.oami.eu, length 28
21:08:04.635592 IP (tos 0x0, ttl 64, id 32337, offset 0, flags [DF], proto UDP (17), length 72)
    overlaytest-hwkqv.53209 > rke2-coredns-rke2-coredns.kube-system.svc.cluster.local.domain: [bad udp cksum 0x36a8 -> 0x498b!] 26729+ PTR? 71.106.136.10.in-addr.arpa. (44)
21:08:04.754504 IP (tos 0x0, ttl 64, id 2549, offset 0, flags [DF], proto UDP (17), length 70)
    overlaytest-hwkqv.55437 > rke2-coredns-rke2-coredns.kube-system.svc.cluster.local.domain: [bad udp cksum 0x36a6 -> 0x07fe!] 56698+ PTR? 10.0.172.10.in-addr.arpa. (42)
21:08:04.756567 IP (tos 0x0, ttl 62, id 5282, offset 0, flags [DF], proto ICMP (1), length 84)
    ocvlt-kub386.test.oami.eu > overlaytest-hwkqv: ICMP echo request, id 64684, seq 13, length 64
21:08:04.756587 IP (tos 0x0, ttl 64, id 48669, offset 0, flags [none], proto ICMP (1), length 84)
    overlaytest-hwkqv > ocvlt-kub386.test.oami.eu: ICMP echo reply, id 64684, seq 13, length 64
21:08:05.782945 IP (tos 0x0, ttl 62, id 5507, offset 0, flags [DF], proto ICMP (1), length 84)
    ocvlt-kub386.test.oami.eu > overlaytest-hwkqv: ICMP echo request, id 64684, seq 14, length 64
21:08:05.782984 IP (tos 0x0, ttl 64, id 49161, offset 0, flags [none], proto ICMP (1), length 84)
    overlaytest-hwkqv > ocvlt-kub386.test.oami.eu: ICMP echo reply, id 64684, seq 14, length 64
21:08:06.806891 IP (tos 0x0, ttl 62, id 6098, offset 0, flags [DF], proto ICMP (1), length 84)
    ocvlt-kub386.test.oami.eu > overlaytest-hwkqv: ICMP echo request, id 64684, seq 15, length 64
21:08:06.806921 IP (tos 0x0, ttl 64, id 49472, offset 0, flags [none], proto ICMP (1), length 84)
    overlaytest-hwkqv > ocvlt-kub386.test.oami.eu: ICMP echo reply, id 64684, seq 15, length 64
21:08:07.830930 IP (tos 0x0, ttl 62, id 6730, offset 0, flags [DF], proto ICMP (1), length 84)
    ocvlt-kub386.test.oami.eu > overlaytest-hwkqv: ICMP echo request, id 64684, seq 16, length 64
21:08:07.830956 IP (tos 0x0, ttl 64, id 49994, offset 0, flags [none], proto ICMP (1), length 84)
    overlaytest-hwkqv > ocvlt-kub386.test.oami.eu: ICMP echo reply, id 64684, seq 16, length 64
21:08:08.854858 IP (tos 0x0, ttl 62, id 6808, offset 0, flags [DF], proto ICMP (1), length 84)
    ocvlt-kub386.test.oami.eu > overlaytest-hwkqv: ICMP echo request, id 64684, seq 17, length 64
21:08:08.854880 IP (tos 0x0, ttl 64, id 50615, offset 0, flags [none], proto ICMP (1), length 84)
    overlaytest-hwkqv > ocvlt-kub386.test.oami.eu: ICMP echo reply, id 64684, seq 17, length 64
21:08:09.874016 ARP, Ethernet (len 6), IPv4 (len 4), Request who-has overlaytest-hwkqv tell ocvlt-kub386.test.oami.eu, length 28
21:08:09.878946 IP (tos 0x0, ttl 62, id 7221, offset 0, flags [DF], proto ICMP (1), length 84)
    ocvlt-kub386.test.oami.eu > overlaytest-hwkqv: ICMP echo request, id 64684, seq 18, length 64
21:08:09.878972 IP (tos 0x0, ttl 64, id 50778, offset 0, flags [none], proto ICMP (1), length 84)
    overlaytest-hwkqv > ocvlt-kub386.test.oami.eu: ICMP echo reply, id 64684, seq 18, length 64
21:08:10.898005 ARP, Ethernet (len 6), IPv4 (len 4), Request who-has overlaytest-hwkqv tell ocvlt-kub386.test.oami.eu, length 28
21:08:10.902870 IP (tos 0x0, ttl 62, id 8220, offset 0, flags [DF], proto ICMP (1), length 84)
    ocvlt-kub386.test.oami.eu > overlaytest-hwkqv: ICMP echo request, id 64684, seq 19, length 64
21:08:10.902894 IP (tos 0x0, ttl 64, id 51779, offset 0, flags [none], proto ICMP (1), length 84)
    overlaytest-hwkqv > ocvlt-kub386.test.oami.eu: ICMP echo reply, id 64684, seq 19, length 64
21:08:11.922087 ARP, Ethernet (len 6), IPv4 (len 4), Request who-has overlaytest-hwkqv tell ocvlt-kub386.test.oami.eu, length 28
21:08:11.926967 IP (tos 0x0, ttl 62, id 8474, offset 0, flags [DF], proto ICMP (1), length 84)
    ocvlt-kub386.test.oami.eu > overlaytest-hwkqv: ICMP echo request, id 64684, seq 20, length 64
21:08:11.926998 IP (tos 0x0, ttl 64, id 52218, offset 0, flags [none], proto ICMP (1), length 84)
    overlaytest-hwkqv > ocvlt-kub386.test.oami.eu: ICMP echo reply, id 64684, seq 20, length 64
21:08:12.951904 ARP, Ethernet (len 6), IPv4 (len 4), Request who-has overlaytest-hwkqv tell ocvlt-kub386.test.oami.eu, length 28
21:08:13.970024 ARP, Ethernet (len 6), IPv4 (len 4), Request who-has overlaytest-hwkqv tell ocvlt-kub386.test.oami.eu, length 28
21:08:14.994023 ARP, Ethernet (len 6), IPv4 (len 4), Request who-has overlaytest-hwkqv tell ocvlt-kub386.test.oami.eu, length 28
21:08:16.022936 ARP, Ethernet (len 6), IPv4 (len 4), Request who-has overlaytest-hwkqv tell ocvlt-kub386.test.oami.eu, length 28
21:08:17.042025 ARP, Ethernet (len 6), IPv4 (len 4), Request who-has overlaytest-hwkqv tell ocvlt-kub386.test.oami.eu, length 28
21:08:18.066009 ARP, Ethernet (len 6), IPv4 (len 4), Request who-has overlaytest-hwkqv tell ocvlt-kub386.test.oami.eu, length 28
```

**Comment by brandond** [comment]
I see some UDP checksum errors. Are you by any chance running on vmware?

**Comment by panstou** [comment]
Yes, all VMs are on top of ESXi. We have the following implementations:

-  RKE v1.30.4 on OL8 with Calico using IPIP and BGP -> _works fine_
-  RKE2 v1.30.8+rke2r1 on OL8 with Calico using VXLAN -> _works fine_
-  RKE2 v1.30.8+rke2r1 on OL9 with flannel only using VXLAN -> _works fine_
-------------------------------------------------------------------------------------------------------------
-  RKE2 v1.30.8+rke2r1 on OL9 with Calico using VXLAN -> _doesn't work_
-  RKE2 v1.30.8+rke2r1 on OL9 with Canal (flannel+calico) using VXLAN -> _doesn't work_

**Comment by brandond** [comment]
Have you looked into disabling checksum offload on the vxlan interfaces? That is the most common cause of dropped packets on VMware.

**Comment by panstou** [comment]
That was one of the first things I checked.
```
# ethtool -k  vxlan.calico | grep generic
        tx-checksum-ip-generic: off
```

This issue seems to be related to Calico networking inside the node.

```
# ping -I 10.171.96.192 10.171.96.195
PING 10.171.96.195 (10.171.96.195) from 10.171.96.192 : 56(84) bytes of data.
From 10.171.96.192 icmp_seq=1 Destination Host Unreachable
From 10.171.96.192 icmp_seq=2 Destination Host Unreachable
From 10.171.96.192 icmp_seq=3 Destination Host Unreachable
^C
--- 10.171.96.195 ping statistics ---
5 packets transmitted, 0 received, +3 errors, 100% packet loss, time 4088ms
pipe 4

# arp -a | grep cali
? (10.171.54.133) at 66:79:ec:44:9c:ae [ether] PERM on vxlan.calico
? (10.171.44.195) at 66:62:82:83:47:01 [ether] PERM on vxlan.calico
? (10.171.96.193) at <incomplete> on cali60f27bfb689 <-------------------------
? (10.171.33.1) at 66:37:95:22:c7:66 [ether] PERM on vxlan.calico
? (10.171.96.195) at <incomplete> on calif4156e36b37 <-------------------------
? (10.171.249.193) at 66:cd:88:17:a2:71 [ether] PERM on vxlan.calico
? (10.171.96.194) at 96:8d:52:0b:93:88 [ether] on calid6fbbc33834
? (10.171.160.68) at 66:5d:3e:73:0c:6d [ether] PERM on vxlan.calico
```
```
# ip -o -4 a
1: lo    inet 127.0.0.1/8 scope host lo\       valid_lft forever preferred_lft forever
2: ens192    inet 10.136.106.70/23 brd 10.136.107.255 scope global noprefixroute ens192\       valid_lft forever preferred_lft forever
28: vxlan.calico    inet 10.171.96.192/32 scope global vxlan.calico\       valid_lft forever preferred_lft forever

# ip link show | grep cali
28: vxlan.calico: <BROADCAST,MULTICAST,UP,LOWER_UP> mtu 1450 qdisc noqueue state UNKNOWN mode DEFAULT group default qlen 1000
31: cali60f27bfb689@if2: <BROADCAST,MULTICAST,UP,LOWER_UP> mtu 1450 qdisc noqueue state UP mode DEFAULT group default qlen 1000
32: calid6fbbc33834@if2: <BROADCAST,MULTICAST,UP,LOWER_UP> mtu 1450 qdisc noqueue state UP mode DEFAULT group default qlen 1000
33: calif4156e36b37@if2: <BROADCAST,MULTICAST,UP,LOWER_UP> mtu 1450 qdisc noqueue state UP mode DEFAULT group default qlen 1000
```

```
# calicoctl node  checksystem
Checking kernel version...
                5.15.0-300.163.18.el9uek.x86_64                                 OK
Checking kernel modules...
                xt_conntrack                                            OK
                ip_set                                                  OK
                ip6_tables                                              OK
                vfio-pci                                                OK
                ipt_REJECT                                              OK
                xt_rpfilter                                             OK
                xt_u32                                                  OK
                ip_tables                                               OK
                ipt_ipvs                                                OK
                ipt_rpfilter                                            OK
                nf_conntrack_netlink                                    OK
                xt_set                                                  OK
                ipt_set                                                 OK
                xt_addrtype                                             OK
                xt_icmp                                                 OK
                xt_multiport                                            OK
                xt_bpf                                                  OK
                xt_icmp6                                                OK
                xt_mark                                                 OK
System meets minimum system requirements to run Calico!
------------------------------------------------------------------------------------------
# calicoctl get workloadendpoints --allow-version-mismatch
WORKLOAD             NODE           NETWORKS            INTERFACE
overlaytest-4qvfq    XXXXXXXXX7   10.171.160.77/32    calided4d8b4d24
overlaytest-4zh5s    XXXXXXXXX5   10.171.96.193/32    cali60f27bfb689
overlaytest-6vqsx    XXXXXXXXX0   10.171.54.134/32    calia54632ff81d
overlaytest-dcclp    XXXXXXXXX8   10.171.44.196/32    cali4a9733d25a0
overlaytest-hwkqv    XXXXXXXXX6   10.171.33.2/32      cali98e7a4c5a9b
overlaytest-j27zm    XXXXXXXXX9   10.171.249.192/32   cali9145ed38b5a
overlaytest2-bkbbz   XXXXXXXXX8   10.171.44.197/32    cali91f50bef26b
overlaytest2-cfv9g   XXXXXXXXX7   10.171.160.78/32    cali1b33d777534
overlaytest2-d9jsm   XXXXXXXXX9   10.171.249.194/32   cali9fac0499149
overlaytest2-tmvgz   XXXXXXXXX6   10.171.33.3/32      calica89439d255
overlaytest2-v2dcp   XXXXXXXXX5   10.171.96.195/32    calif4156e36b37
overlaytest2-z6cgm   XXXXXXXXX0   10.171.54.135/32    calie5b402fca47
---------------------------------------------------------------------------------------------
```

**Comment by tomastigera** [comment]
If you are running on VMWare and you are running with vxlan, you need to change the default vxlan port. It is a vmware limitation 🤷‍♂  see https://github.com/projectcalico/calico/issues/8349#issuecomment-1927308528

**Comment by tomastigera** [comment]
Seems like that is the case for a whole bunch of people https://github.com/projectcalico/calico/issues/9433 unfortunately is looks like the vmware docs link from the comment I linked above is dead now.

**Comment by brandond** [comment]
The best summary I have seen is in the discussion at https://github.com/projectcalico/calico/issues/4727
